,Unnamed: 0.1,Unnamed: 0,country,description,designation,points,price,province,region_1,region_2,taster_name,taster_twitter_handle,title,variety,winery,img_url,extracted_flavors,wine_type,year
703,891,2280,US,"There is loads of freshly crushed black pepper in this dry, robust Zin. It's almost enough to make you sneeze. You'll also find good blackberry fruit and heady alcohol. Drink up.",,85,17,California,Napa Valley,Napa,,,Dominican Oaks 2010 Zinfandel,Zinfandel,Dominican Oaks,https://images.vivino.com/thumbs/g4mHjhK3QWWiQtmeS88LIA_150x200.jpg,"['fruit', 'berry', 'pepper']",red,2010
704,893,79856,US,"This dark-colored wine shows Malbec's rustic side, with scratchy tannins and tons of blackberry flavor. It's one-dimensional, but perfect to enjoy with a barbecued steak.",,84,15,California,Paso Robles,Central Coast,,,Clayhouse 2011 Malbec,Malbec,Clayhouse,https://images.squarespace-cdn.com/content/v1/543f23d7e4b0bda0c64b6c32/1447992449237-P99SF0G1862FHWA6081K/image-asset.jpeg,['berry'],red,2011
705,894,106742,US,"Toast aromas accent ripe pears and golden-delicious apples in this soft, easy-to-like Chard that only lacks a bit of depth. A slightly bitter note on the finish should become less noticeable over the next few months.",,83,10,New York,North Fork of Long Island,Long Island,Joe Czerwinski,@JoeCz,Martha Clara 1999 Chardonnay,Chardonnay,Martha Clara,"https://www.wine-searcher.com/images/labels/21/47/10372147.jpg?width=260&height=260&fit=bounds&canvas=260,260","['apple', 'pear']",white,1999
706,895,85296,US,"For the fan of big, bold flavor, this Rutherford red is robust in tannin and oak, as well as full, ripe waves of blueberry, black cherry and chocolate. Interspersed among the enjoyable proceedings are dessert-like elements of caramel and cinnamon.",,90,40,California,Rutherford,Napa,Virginie Boone,@vboone,Sanctuary 2013 Cabernet Sauvignon,Cabernet Sauvignon,Sanctuary,https://www.wineenthusiast.com/wp-content/assets/reviews/label-images/wine/wine/248766_102be_boybg16_3730.jpg,"['berry', 'cherry', 'chocolate', 'oak']",red,2013
707,896,24665,US,"All stainless steel fermented using Dijon clones. A clean, delicate style, but with an elegant touch and nuances of honey, clove. Very well balanced and textured, with a light but long progression of flavors.",,88,16,Oregon,Rogue Valley,Southern Oregon,Paul Gregutt,@paulgwine ,Paschal 1999 Chardonnay,Chardonnay,Paschal,http://res.cloudinary.com/winecom/image/upload/51903_refDetail-0,['honey'],white,1999
708,897,69422,France,"Supple and fruity, this is bright with red fruits given a lift with spice. The wine is all about fruit with acidity to add a fresher character. Tannins are already integrating meaning the wine will be ready soon. Drink from 2016.",Tertre-Perdigous,87,16,Southwest France,Cahors,,Roger Voss,@vossroger,Château du Port 2013 Tertre-Perdigous Malbec-Merlot,Malbec-Merlot,Château du Port,https://www.wineenthusiast.com/wp-content/uploads/2024/04/04_24_Best-Argentinian-Malbecs_HERO_WineOnSale_Wine.com_WineChild_1920x1280.jpg,"['fruit', 'spice']",red,2013
709,898,36657,Argentina,"Floral aromas of orange peel, rose petal and violet blend with more typical scents of tar and char. This Malbec blend is linear in feel but full, without an ounce of flab. Lightly spiced berry, red plum and chocolaty oak flavors finish toasty and tight, but with give. Drink 2017–2023.",Toko Vineyard El Corte,92,25,Mendoza Province,Mendoza,,Michael Schachner,@wineschach,ZaHa 2014 Toko Vineyard El Corte Red,Red Blend,ZaHa,https://southernwines.com/wp-content/uploads/2023/10/Zaha-El-Corte-2014.jpg,"['berry', 'oak', 'spice', 'floral', 'orange', 'plum']",red,2014
710,900,41681,US,"From the only Riesling vines planted in the Walla Walla AVA, this Figgins wine club-only selection makes you wish for more. It has lovely layering of citrus pith and rind flavors, a mouth-cleansing minerality, and exceptional depth of flavor. Finished completely dry, it registers just 12% alcohol.",Estate,90,30,Washington,Walla Walla Valley (WA),Columbia Valley,Paul Gregutt,@paulgwine ,Figgins 2013 Estate Riesling ),Riesling,Figgins,https://images.squarespace-cdn.com/content/v1/6491b927c3f15c2096c697a2/5bedd5bd-2c87-4290-981c-5557dd593ddd/2013+Estate+Red.png,"['citrus', 'mineral']",white,2013
711,901,76873,US,"Powerful and delicious flavors are matched by bold and supportive tannins in this almost larger-than-life wine. Ripe black cherry, plum and anise flavors are nicely wrapped up in a texture that lifts and balances them for a seamless impression on the palate. The delicious fruit notes and lightly spicy nuances linger beautifully on the finish.",Morine Ranch,92,40,California,High Valley,,Jim Gordon,@gordone_cellars,Shannon Ridge 2012 Morine Ranch Tempranillo,Tempranillo,Shannon Ridge,https://images.vivino.com/labels/ZfmMerDmQNyRCilUnXmA8A.jpg,"['fruit', 'cherry', 'plum']",red,2012
712,903,17372,US,"This is a delightfully light-pink blend of Grenache, Merlot, Sangiovese and Syrah from different pockets of the county. Subtle strawberry, Mandarin orange and nutty flavors play off the moderate acidity and pretty white flower notions.",,88,16,California,Sonoma County,Sonoma,Virginie Boone,@vboone,Angels & Cowboys 2016 Rosé,Rosé,Angels & Cowboys,https://www.liquorstore-online.com/product_images/p_197252.jpg,"['berry', 'nut', 'orange']",rosé,2016
713,906,575,France,"This is a juicy wine with its red fruits and attractive acidity. The wood aging still shows, perhaps too strongly, but that fruit is already a major factor in the success of the wine. Drink from 2019.",,89,14,Bordeaux,Bordeaux Supérieur,,Roger Voss,@vossroger,Château de l'Aubrade 2015  Bordeaux Supérieur,Bordeaux-style Red Blend,Château de l'Aubrade,"https://www.totalwine.com/dynamic/x1000,sq/media/sys_master/twmmedia/ha0/h5a/28263400341534.png",['fruit'],red,2015
714,909,109478,France,"This is a honeyed, sweet wine (a fact not indicated on the label). Spice is surrounded by ripe fruits, apricot and lychee, with added pepper. Some citrus acidity comes through at the end. Drink now.",Steinklotz Grand Cru,89,25,Alsace,Alsace,,Roger Voss,@vossroger,Helfrich 2009 Steinklotz Grand Cru Gewurztraminer,Gewürztraminer,Helfrich,https://cookingdistrict.com/cd/general.nsf/blogbydate/53E2F169B7734C4185257B83001821AD/$File/HELFRICH%20GRAND%20CRU%20GEWURZhome.jpg,"['fruit', 'citrus', 'spice', 'pepper', 'honey']",white,2009
715,910,104179,Italy,"Aged partly in concrete vats and partly in oak, this shows concentrated sensations of ripe plum, sour cherry and raspberry layered with espresso notes. Pair this with grilled vegetables or spicy cheeses.",,87,28,Tuscany,Chianti Classico,,Kerin O’Keefe,@kerinokeefe,Principe Corsini Fattoria Le Corti 2010  Chianti Classico,Red Blend,Principe Corsini Fattoria Le Corti,https://principecorsini.s3.eu-central-1.amazonaws.com/wp-content/uploads/2020/03/08165635/Cortevecchia-2020-chianti-classico-riserva-docg-principe-corsini-1024x1024.png,"['berry', 'cherry', 'oak', 'plum']",red,2010
716,911,119808,Italy,"Aromas of mocha, violet, espresso and leather lead the nose. The jammy palate offers juicy black cherry, licorice and grilled herb while a blast of orange zest lifts the finish. Fresh acidity and polished tannins provide balance.",,90,50,Piedmont,Barbaresco,,Kerin O’Keefe,@kerinokeefe,Luigi Voghera 2013  Barbaresco,Nebbiolo,Luigi Voghera,https://binendswine.com/cdn/shop/files/VogheraBarbaresco.jpg?v=1714143053&width=1080,"['cherry', 'herb', 'leather', 'orange']",red,2013
717,912,119528,US,"Dry and well balanced but also full flavored, this will be a great go-to bubbly to have ready in the fridge for any minor or major occasion. There are ripe fruits along with crisp citrus notes, lively acidity, a rich mousse of bubbles and lingering finish.",Blanc de Blancs,92,40,California,North Coast,North Coast,Jim Gordon,@gordone_cellars,Schramsberg 2014 Blanc de Blancs Chardonnay,Chardonnay,Schramsberg,https://freerangebrooklyn.com/wp-content/uploads/j-schram-2014-blanc-back.jpg,"['fruit', 'citrus']",white,2014
718,913,35487,Australia,"A fresh, fruity and fun rendering of Pinot Noir, this medium-bodied wine features lightly floral aromas, red cherry and raspberry fruit and a silky, mouthwatering finish. Drink now–2020.",,90,17,South Australia,Adelaide Hills,,Joe Czerwinski,@JoeCz,Wakefield 2015 Pinot Noir,Pinot Noir,Wakefield,https://cdn.ct-static.com/labels/1abb9881-4c27-450b-a9a8-1c9f8f095f42.jpg,"['fruit', 'berry', 'cherry', 'floral']",red,2015
719,915,20972,France,"Bitter chocolate aromas and woody flavors are the hallmarks of this smoky, burnt toast-inflected wine. That bitter quality probably won't go away, leaving the fruit behind.",,85,17,Bordeaux,Cadillac Côtes de Bordeaux,,Roger Voss,@vossroger,Château de Fontenille 2015  Cadillac Côtes de Bordeaux,Bordeaux-style Red Blend,Château de Fontenille,https://wardmanwines.com/cdn/shop/products/I0010752_cotesdecadillacnvbtl_750x.jpg?v=1669923320,"['fruit', 'chocolate']",red,2015
720,916,111618,Italy,"Sangiovese fruit is presented in its most genuine and clean state, with bright berry nuances, violets, moist earth, tobacco and cola. There are wood elements, but they are unobstructive, clean and otherwise relegated to a supporting role. The bouquet shows wild berry, bramble and bright acidity.",Marchese Antinori Riserva,89,35,Tuscany,Chianti Classico,,,,Marchesi Antinori 2007 Marchese Antinori Riserva,Red Blend,Marchesi Antinori,"https://www.wine-searcher.com/images/labels/95/60/11439560.jpg?width=260&height=260&fit=bounds&canvas=260,260","['fruit', 'berry', 'earth']",red,2007
721,918,127915,France,"This wine is structured, firm and has a mineral, tight texture. It also offers plenty of red apples, green plums and a touch of apricot. However, with its nervy edge the wine needs to age; drink from 2017.",Le Charmois Premier Cru,89,40,Burgundy,Saint-Aubin,,Roger Voss,@vossroger,Au Pied du Mont Chauve 2012 Le Charmois Premier Cru,Chardonnay,Au Pied du Mont Chauve,https://cdn.ct-static.com/labels/7585424b-1c53-4e73-adfa-055c3ccc08dd.jpg,"['apple', 'mineral', 'plum']",white,2012
722,919,7326,Spain,"Green, lemony and murky on the nose, this young wine shows that a good vintage in a renowned region doesn't always amount to a good wine. This is a funky, earthy specimen with burnt notes and a grassy aftertaste.",Vall Sanzo,81,13,Northern Spain,Ribera del Duero,,Michael Schachner,@wineschach,Valsanzo 2005 Vall Sanzo,Tempranillo,Valsanzo,https://images.vivino.com/thumbs/eAHB7KTNSo-Ct5hHwiV1BA_pb_x600.png,"['lemon', 'earth', 'lemon']",red,2005
723,920,48452,Portugal,"This fruity, unoaked wine is bright with citrus and crisp apple flavors, lightly perfumed from the Verdelho and Cerceal grapes in the blend. It's a refreshing wine that is ready now.",Porca de Murça Reserva Branco,88,20,Douro,,,Roger Voss,@vossroger,Real Companhia Velha 2015 Porca de Murça Reserva Branco White,Portuguese White,Real Companhia Velha,https://portugalgetwine.com/1274-thickbox_default/porca-de-murca-reserva-white-wine.jpg,"['fruit', 'citrus', 'apple', 'oak']",white,2015
724,921,87669,US,"This is done in a lightly spicy, lightly toasty style. It's clean and supple, with a mix of apple, peach and melon fruit. Ample acidity keeps it fresh and lively through the finish. It spent six months in a mix of one-third stainless and two-thirds neutral oak.",,88,20,Oregon,Willamette Valley,,Paul Gregutt,@paulgwine ,Lazy River 2014 Pinot Gris,Pinot Gris,Lazy River,https://images.commerce7.com/r-stuart-co/images/medium/12-1674686135096.png,"['fruit', 'apple', 'peach', 'oak']",white,2014
725,922,84185,Germany,"This starts off with some odd wet wool and fresh tar notes, but quickly rights itself, delivering a medium-bodied mouthful of crisp lime and melon fruit. If possible, give it a quick splash in a decanter before drinking.",Kabinett,88,25,Nahe,,,Joe Czerwinski,@JoeCz,Schäfer-Fröhlich 2005 Kabinett Riesling,Riesling,Schäfer-Fröhlich,https://cdn.ct-static.com/labels/8a166fc1-23f5-43ab-9ce4-2b3ac0ec0cd5.jpg,"['fruit', 'lime']",white,2005
726,925,59401,US,"An old-vine field blend of Gewürztraminer, Trousseau Gris and Riesling, this vintage is tiny in production but boldly delicious in flavor and intent. Bright pretty aromatics of honeysuckle meet a balanced layering of creamy white peach, apple and wild vanilla, blessed by supportive acidity.",Compagni Portis,94,30,California,Sonoma Valley,Sonoma,Virginie Boone,@vboone,Carlisle 2015 Compagni Portis White,White Blend,Carlisle,https://shop.klwines.com/_next/image?url=https%3A%2F%2Fcdn.klwines.com%2Fimages%2Fskus%2Fshiner_white_x.jpg&w=256&q=75,"['apple', 'peach', 'vanilla', 'honey']",white,2015
727,926,53523,Italy,"Scents of ripe berry, grilled herb, sunbaked soil, violet and menthol lead on this fragrant red. The savory, straightforward palate offers mature black cherry, sage and a hint of anise alongside lithe tannins. Enjoy through 2018.",,89,18,Tuscany,Chianti Classico,,Kerin O’Keefe,@kerinokeefe,Ormanni 2012  Chianti Classico,Red Blend,Ormanni,http://www.searedliving.com/cdn/shop/products/ormanni-chianti-classico-426252.jpg?v=1694566421,"['berry', 'cherry', 'herb']",red,2012
728,927,120069,US,"Bristles of lemon-lime acidity lend energy and vibe to this unusually refreshing Gewürztraminer. Perfumed with ripe tropical fruit and voluptuous on the palate, it maintains varietal typicity, but has an irresistible zest that's worth seeking out.",,89,15,New York,Finger Lakes,Finger Lakes,Anna Lee C. Iijima,,Standing Stone 2013 Gewürztraminer,Gewürztraminer,Standing Stone,https://winecasual.com/wp-content/uploads/2019/11/IMG_4754a.jpg,"['fruit', 'tropical', 'lemon', 'lime', 'lemon']",white,2013
729,928,21973,Chile,"Montes' first Alpha Malbec is serious and healthy, with rubbery, leathery berry aromas and crusty, dark oak scents. This is full and fairly oaky on the tongue, with herbal black-fruit flavors, raw wood notes, espresso-like bitterness and heat on the finish.",Alpha,88,25,Colchagua Valley,,,Michael Schachner,@wineschach,Montes 2010 Alpha Malbec,Malbec,Montes,https://www.luekensliquors.com/wp-content/uploads/2018/09/97971-MONTES-ALPHA-MALBEC.png,"['fruit', 'berry', 'oak', 'herb', 'leather']",red,2010
730,929,27480,US,"Big, hearty fruit flavors and full body without a lot of tannin make this wine appealing and a good match for meaty dishes from carne asada burritos to pot roast. It's probably no coincidence considering the brand name that it has lots of oak flavor, adding vanilla and other spices.",Tievoli,86,24,California,Lodi,Central Valley,Jim Gordon,@gordone_cellars,Oak Farm 2014 Tievoli Red,Red Blend,Oak Farm,"https://www.wine-searcher.com/images/labels/34/45/11643445.jpg?width=260&height=260&fit=bounds&canvas=260,260","['fruit', 'vanilla', 'oak', 'spice']",red,2014
731,930,63557,Germany,"Delicate whiffs of tangerine and lime intensify on the palate of this Spätlese Riesling, complemented by swathes of green herb and pine frond. It's superlight in texture, yet penetrating, showering the palate in sweet-tart grapefruit and Meyer lemon flavors. The finish is crisp and clean.",Graacher Himmelreich Spätlese,90,30,Mosel,,,Anna Lee C. Iijima,,Dr. Heidemanns-Bergweiler 2014 Graacher Himmelreich Spätlese Riesling,Riesling,Dr. Heidemanns-Bergweiler,https://cdn.ct-static.com/labels/f4886cb6-d1d4-433c-b7a7-6c55d20b7bcb.jpg,"['fruit', 'lemon', 'lime', 'herb', 'lemon']",white,2014
732,931,10813,Italy,"This opens with raw oak and toasted hazelnut aromas. The closed, bracing palate lacks fruit richness, offering instead oak-driven spice notes bolstered with astringent tannins.",Colle del Gelso,85,50,Piedmont,Barbaresco,,Kerin O’Keefe,@kerinokeefe,Cascina Saria 2013 Colle del Gelso,Nebbiolo,Cascina Saria,https://images.vivino.com/thumbs/wYSGO1qCTQO_KAhy8I_JjA_pb_x600.png,"['fruit', 'oak', 'spice', 'nut']",red,2013
733,933,22648,Austria,"Laurenz Moser V makes deliciously fruity Grüner, allowing the ripe character of the grape to dominate. This wine, bright with apple and citrus flavors, is light, breezy and ready to drink. Screwcap.",Friendly,88,20,Kamptal,,,Roger Voss,@vossroger,Laurenz V. 2012 Friendly Grüner Veltliner,Grüner Veltliner,Laurenz V.,https://s2.wine.style/images_gen/404/40496/0_0_orig.webp,"['fruit', 'citrus', 'apple']",white,2012
734,934,5428,US,"This sports a blue label, to differentiate it from the winery's estate bottling. It's dark and toasty, with robust black-cherry fruit, along with strong notes of charcoal, espresso and vanilla. There's nothing subtle here, but should work well with Korean ribs.",Blue Label,88,20,Oregon,Applegate Valley,Southern Oregon,Paul Gregutt,@paulgwine ,Troon 2013 Blue Label Zinfandel,Zinfandel,Troon,https://www.wineenthusiast.com/wp-content/assets/reviews/label-images/wine/wine/407537_45BE_DEC22.JPG,"['fruit', 'cherry', 'vanilla']",red,2013
735,935,52766,France,"This is a strongly herbal wine. Its acidity and crisp texture give it great lift, bringing out lively fruitiness and a green fruit aftertaste. Drink now.",Château les Jouberts Prestige,86,13,Bordeaux,Blaye Côtes de Bordeaux,,Roger Voss,@vossroger,Les Vignerons de Tutiac 2016 Château les Jouberts Prestige,Bordeaux-style White Blend,Les Vignerons de Tutiac,https://socialvignerons.com/wp-content/uploads/2018/11/2016-Cave-de-Tutiac-Chateau-Les-Jouberts-Cuv%C3%A9e-Prestige-white-wine-Blaye-C%C3%B4tes-de-Bordeaux.jpg,"['fruit', 'herb']",white,2016
736,936,46706,France,"This is a really fragrant wine, with white hedgerow flowers that introduce its rich, full body. It has just a touch of sweetness from the ripe pear and quince flavors, although the texture also has a fine edge of minerality. Age for another 1–2 years.",Eichberg Grand Cru,91,35,Alsace,Alsace,,Roger Voss,@vossroger,Domaine Zinck 2009 Eichberg Grand Cru Riesling,Riesling,Domaine Zinck,https://media-cdn.tripadvisor.com/media/photo-m/1280/1c/25/e5/a5/gamme-grand-cru-domaine.jpg,"['pear', 'mineral']",white,2009
737,937,9351,US,"Aside from hints of dark wild raspberries, this entry-level, second-label wine by Norm Yost doesn't offer overt fruit on the nose, instead showing graphite, dark earth and crushed rocks. Earthy flavors of beet juice and juniper show a slightly sour side, making for an interesting wine, if not completely delicious",,89,26,California,Santa Barbara County,Central Coast,Matt Kettmann,@mattkettmann,YNOT 2013 Pinot Noir,Pinot Noir,YNOT,https://flyinggoatcellars.com/cdn/shop/collections/fullsizeoutput_65a1_1440x.jpg?v=1565814419,"['fruit', 'earth']",red,2013
738,939,3833,France,"Mango aromas and flavors give a sense of the sweetness of the wine. It is rich and full bodied, with spice and pepper notes just hinting at acidity. Keep the wine for 3–5 years.",Brand Grand Cru,93,32,Alsace,Alsace,,Roger Voss,@vossroger,Domaine Ehrhart 2010 Brand Grand Cru Pinot Gris,Pinot Gris,Domaine Ehrhart,https://www.vinsetmillesimes.com/123538-home_default/xbott-geyl-alsace-grand-cru-pinot-gris-furstentum-2004.jpg.pagespeed.ic.JrWJ6aJqkL.jpg,"['spice', 'pepper']",white,2010
739,940,121578,US,"Aromas of crème brûlée, apple, vanilla and spice lead to broad-feeling fruit flavors speckled with barrel accents. It's a very pleasing, well-priced offering of the variety.",Traditions,89,13,Washington,Columbia Valley (WA),Columbia Valley,Sean P. Sullivan,@wawinereport,Milbrandt 2015 Traditions Chardonnay ),Chardonnay,Milbrandt,"https://assets.wine.com/winecom/image/upload/w_600,h_600,dpr_2.0,c_fit,q_auto:good,fl_progressive/163965.jpg","['fruit', 'apple', 'vanilla', 'spice']",white,2015
740,942,16432,Austria,"A slightly green edge adheres to the zesty yellow grapefruit notes on the nose, the palate is light-bodied but fizzes with freshness and crunchy acidity. Drink soon.",Ried Steinertal Smaragd,89,39,Wachau,,,Anne Krebiehl MW,@AnneInVino,Tegernseerhof 2014 Ried Steinertal Smaragd Riesling,Riesling,Tegernseerhof,"https://www.wine-searcher.com/images/labels/51/64/10385164.jpg?width=260&height=260&fit=bounds&canvas=260,260",['fruit'],white,2014
741,943,5464,US,"There are some lean, green peppercorn, mint and herb flavors that suggest unripeness. The chilly vintage appears to have taken its toll, despite some well-oaked raspberry and cherry lushness. Drink up.",La Encantada Vineyard,86,50,California,Sta. Rita Hills,Central Coast,,,Longoria 2011 La Encantada Vineyard Pinot Noir,Pinot Noir,Longoria,"https://www.wine-searcher.com/images/labels/58/29/10345829.jpg?width=260&height=260&fit=bounds&canvas=260,260","['berry', 'pear', 'cherry', 'oak', 'pepper', 'herb']",red,2011
742,944,104382,Australia,"A unique blend of spice and blueberry sets this Shiraz apart from the pack, and it pulls away even further due to a lush, creamy texture and long, mouthcoating finish. There's great purity to the fruit, but enough peppery spice for complexity. Drink now–2016.",Single Vineyard,91,25,South Australia,McLaren Vale,,Joe Czerwinski,@JoeCz,Yangarra Estate Vineyard 2006 Single Vineyard Shiraz,Shiraz,Yangarra Estate Vineyard,https://ip.prod.freshop.retail.ncrcloud.com/resize?url=https://images.freshop.ncrcloud.com/00784938001123/ed6f431d08ef4e5fa811900a52fb9473_large.png&width=512&type=webp&quality=90,"['fruit', 'berry', 'spice', 'pepper']",red,2006
743,946,126721,Italy,"This sparkler opens with a very pale golden color and lively bubbling. But looks can be deceiving because its intense aromas are anything but plain: Sweet floral tones mingle with peach, herbal notes and bee's wax.",Dry Millesimato,86,21,Veneto,Prosecco di Conegliano e Valdobbiadene,,,,Montesel Renzo 2006 Dry Millesimato,Prosecco,Montesel Renzo,https://www.wineenthusiast.com/wp-content/uploads/2024/09/09_24_Rose_Champagne_HERO_Wine.com_TotalWine_1920x1280.jpg,"['peach', 'herb', 'floral']",sparkling,2006
744,947,47895,US,"The immediate impression is of savory umami aromas pierced with pine needle and sage highlights. Red and black licorice, along with sweet cured meats, bring complexity to fruit flavors of berry, cherry and plum. Toss in Provençal spices, coffee grounds and the classic Cayuse earthiness that continues through a deep, firm, beautifully defined finish. Drink now through 2030.",En Cerise Vineyard,98,75,Oregon,Walla Walla Valley (OR),Oregon Other,Paul Gregutt,@paulgwine ,Cayuse 2011 En Cerise Vineyard Syrah ),Syrah,Cayuse,https://cdn.klwines.com/images/skus/1151104x.jpg,"['fruit', 'berry', 'cherry', 'spice', 'earth', 'coffee', 'plum']",red,2011
745,948,63821,US,"A buttery aroma leads to rich butterscotch flavors and a buttery finish, too. But then there's more with each sip. The wine is dry but easy on the palate, and reveals tasty apple, almond and toasted walnut flavors with time. These all add complexity and lift it well above the ordinary. Made with certified Biodynamic grapes.",The Roost Blue Heron Vineyard,92,45,California,Mendocino County,,Jim Gordon,@gordone_cellars,Bonterra 2012 The Roost Blue Heron Vineyard Chardonnay,Chardonnay,Bonterra,https://s3.amazonaws.com/thewinespies-production/uploads/product/image/4222-4587b0db5d020fc02e43d81e65b6060ca81011a7/tall_product_photo.jpg,"['apple', 'nut', 'butter', 'almond']",white,2012
746,949,84820,France,"Produced from vines mainly planted in the 1970s, this is a concentrated dark wine. Rich and ripe, it has powerful tannins mingled with beautifully perfumed fruits. The wine is dense and packed with floral fruitiness as well as fine, sweet tannins. Drink from 2025.",,95,973,Burgundy,Musigny,,Roger Voss,@vossroger,Domaine Jacques Prieur 2014  Musigny,Pinot Noir,Domaine Jacques Prieur,https://d13qsmwwvi72rl.cloudfront.net/eyJidWNrZXQiOiJwMmdyb3VwIiwia2V5IjoiaXRlbUltYWdlcy9wcm9kdWN0aW9uLzVlNjkyNGFhYWEzZTg3ODQwOGRiMjc5Ny8xNTgzOTUwOTI2ODk1LTIwMDEwLmpwZyIsImVkaXRzIjp7InJlc2l6ZSI6eyJoZWlnaHQiOjYwMCwiZml0IjoiY29udGFpbiJ9fX0=,"['fruit', 'floral']",red,2014
747,950,124981,Argentina,"Rubber and savory berry aromas lead it off. The palate shows good texture and overall smoothness, with round cassis and plum flavors. Very competent and solid on the finish, with toasty, warming afternotes and only a slight tannic grab. Textbook Malbec given the price range.",Ambar 1907,88,18,Mendoza Province,Mendoza,,Michael Schachner,@wineschach,Andes Grapes 2006 Ambar 1907 Malbec,Malbec,Andes Grapes,https://www.wineenthusiast.com/wp-content/uploads/2024/04/04_24_Best-Argentinian-Malbecs_HERO_WineOnSale_Wine.com_WineChild_1920x1280.jpg,"['berry', 'plum']",red,2006
748,951,129397,US,"Marimar Torres frankly calls the planting of these 2 varieties in her estate vineyard, which had previously been to Pinot Noir and Chardonnay, experimental. Much work needs to be done to perfect them. The wine, as it stands, is dry and acidic and one-dimensional in cherry and currant fruit. It requires greater levels of complexity and nuance.",Don Miguel Vineyard Syrah-Tempraillo,85,32,California,Russian River Valley,Sonoma,,,Marimar Estate 2005 Don Miguel Vineyard Syrah-Tempraillo Red,Red Blend,Marimar Estate,"https://www.wine-searcher.com/images/labels/87/13/10478713.jpg?width=260&height=260&fit=bounds&canvas=260,260","['fruit', 'cherry']",red,2005
749,952,65073,Italy,"Restrained at first on the nose, this wine eventually reveals black fruit, cooking spice and underbrush aromas. The simple palate offers dried blackberry and tobacco hints while smooth tannins provide easygoing support. Drink soon.",Castelvero Alasia,86,11,Piedmont,Barbera d'Asti Superiore,,Kerin O’Keefe,@kerinokeefe,Araldica 2015 Castelvero Alasia,Barbera,Araldica,https://images.vivino.com/thumbs/SMnoZ3UwRGizwBeeVHdlWQ_pb_x600.png,"['fruit', 'berry', 'spice']",red,2015
750,955,32153,Portugal,"Solid and chunky, a wine that fills the mouth with its attractive red fruits, structured tannins and a general juicy feel. A fine barbecue wine.",Bigode,86,8,Lisboa,,,Roger Voss,@vossroger,DFJ Vinhos 2009 Bigode Red,Portuguese Red,DFJ Vinhos,http://en.dfjvinhos.com/image/10803.jpg,['fruit'],red,2009
