,Unnamed: 0.1,Unnamed: 0,country,description,designation,points,price,province,region_1,region_2,taster_name,taster_twitter_handle,title,variety,winery,img_url,extracted_flavors,wine_type,year
233,295,108996,US,"From 75% Pinot Noir and 25% Chardonnay, the tirage on this sparkling brut took place in 2008, the late-disgorgement in October 2013. The time in bottle has given it a honey-baked edge, sensibly dry, with highlights of baked apple and dried apricot.",Late Disgorged Vintage Brut,88,45,California,Yountville,Napa,Virginie Boone,@vboone,Chandon 2007 Late Disgorged Vintage Brut Sparkling,Sparkling Blend,Chandon,https://cdn.ct-static.com/labels/273f08cd-c929-402e-861f-55b24b823e07.jpg,"['apple', 'honey']",sparkling,2007
234,296,75072,Portugal,"A blend of Chardonnay with Arinto and Vital, this is a simple, fruity and fragrant wine. It has lively acidity, a crisp, mineral texture and a ripe, full feel at the end. Drink through 2015.",Forgotten Field,85,10,Lisboa,,,Roger Voss,@vossroger,Companhia das Quintas 2013 Forgotten Field White,Portuguese White,Companhia das Quintas,https://winestyleonline.com/images_gen/618/61881/0_0_orig.webp,"['fruit', 'mineral']",white,2013
235,297,108892,Italy,"This is a subdued and somewhat neutral expression of Nebbiolo with measured aromas of black fruit, plum, black currant and moist earth. The wine is definitely more lively in the mouth where it picks up points thanks to its firm disposition and lingering flavors of blackberry and smoke.",Maria di Brün,88,95,Piedmont,Barbaresco,,,,Ca'Romè 2006 Maria di Brün,Nebbiolo,Ca'Romè,https://www.frizza.eu/wp-content/uploads/2022/03/Barbresco-Maria-di-Brun-D.O.C.G.jpg,"['fruit', 'berry', 'smoke', 'earth', 'plum']",red,2006
236,298,17989,US,"Intensely aromatic, yet big and even chunky in the mouth, this young wine remains compressed and hard-edged. Give it ample aeration, and cranberry, blackberry and black cherry fruits come alive. Dense with fruit and detailed with wet stone minerality, this should be cellared a few years, and consumed from 2020 to 2030.",Ribbon Ridge Estate,94,49,Oregon,Ribbon Ridge,Willamette Valley,Paul Gregutt,@paulgwine ,Trisaetum 2015 Ribbon Ridge Estate Pinot Noir,Pinot Noir,Trisaetum,https://www.trisaetum.com/assets/images/products/pictures/2015-Ribbon-Ridge-Pinot.png,"['fruit', 'berry', 'cherry', 'mineral']",red,2015
237,300,92936,US,"As the designation implies, this is a blend of Cabernet Sauvignon and Grenache. The grapes were grown in Coombsville. The wine is fruity and approachable now, with black cherry jam, mocha and exotic baking spice flavors.",Cabernache,87,45,California,Napa Valley,Napa,,,Daviana 2009 Cabernache Red,Red Blend,Daviana,https://images.vivino.com/thumbs/RBONJQkRQwC9oCvqVIr9XQ_pl_480x640.png,"['fruit', 'cherry', 'spice']",red,2009
238,301,90291,US,"This wine is all from Yellow Jacket Vineyard, one of the oldest sites in The Rocks. The aromas bring subdued notes of black pepper, bacon fat, blue and blackberries, flowers, mineral and black olive. It has a hypnotic sense of texture—a very pretty interpretation of the variety and area.",Voyageur,91,40,Washington,Walla Walla Valley (WA),Columbia Valley,Sean P. Sullivan,@wawinereport,Maison Bleue 2013 Voyageur Syrah ),Syrah,Maison Bleue,"https://www.wine-searcher.com/images/labels/84/17/10828417.jpg?width=260&height=260&fit=bounds&canvas=260,260","['pepper', 'mineral']",red,2013
239,302,62334,US,"Brushy sage meets succulent blackberry, blueberry and tar in this impressive wine, which offers generous structure and complex tannin. Though juicy and decidedly enjoyable now, it will benefit from further cellaring; best 2022 through 2032.",Cabernet Bosché,94,150,California,Rutherford,Napa,Virginie Boone,@vboone,Freemark Abbey 2012 Cabernet Bosché Cabernet Sauvignon,Cabernet Sauvignon,Freemark Abbey,https://www.wineenthusiast.com/wp-content/assets/reviews/label-images/wine/wine/259933_69be_june17_3780.jpg,['berry'],red,2012
240,305,39362,Portugal,"This is a powerfully structured wine from one of the pioneers of Merlot in Bairrada. It is dark with tannins while also brimming with great black-fruit flavors. Rounded, balancing fruit and acidity, the wine is smooth, rich and now ready to drink.",Reserva,91,20,Bairrada,,,Roger Voss,@vossroger,Nelson Neves 2013 Reserva Merlot,Merlot,Nelson Neves,https://www.winespiritus.com/5190-large_default/nelson-neves-reserva-2013-red-wine.jpg,['fruit'],red,2013
241,306,40719,US,"A big, fruity Cabernet that hardly shows a day of age at nearly six years. It's still rich and ripe in blackberry, blueberry and cherry jam flavors. Drink up.",Mountain,86,25,California,Napa Valley,Napa,,,Red Table Cellars 2006 Mountain Cabernet Sauvignon,Cabernet Sauvignon,Red Table Cellars,https://www.keenanwinery.com/wp-content/uploads/2022/09/Keenan-Secret-Wine-_0003_Keenan-Secret-Wine-Tribute-min-scaled-1.jpg,"['fruit', 'berry', 'cherry']",red,2006
242,310,51589,US,"The chilly vintage has produced a very dry, young wine whose flavors veer toward acid-inspired mineral, citrus peel and apricots, rather than the riper flavors of a warmer year, such as 2008. The result is a tight Chardonnay, one more geared for revealing complexities than for opulence.",Ruxton Vineyard,90,35,California,Russian River Valley,Sonoma,,,Lost Canyon 2010 Ruxton Vineyard Chardonnay,Chardonnay,Lost Canyon,https://s3.amazonaws.com/thewinespies-production/uploads/product/image/2114-d10a3e4edd82b96430e0f878611e5fae85039155/tall_product_photo.jpg,"['citrus', 'mineral']",white,2010
243,311,128412,Argentina,"Leafy raspberry aromas are offset by cured-meat notes of sausage or ballpark hot dogs. This has a creamy yet flabby mouthfeel with barely detectable acidity. Baked cherry and raspberry flavors show touches of cinnamon and chocolate, while the finish is dull.",,84,13,Mendoza Province,Mendoza,,Michael Schachner,@wineschach,Ombu 2012 Pinot Noir,Pinot Noir,Ombu,https://www.wineenthusiast.com/wp-content/uploads/2024/04/04_24_Best-Argentinian-Malbecs_HERO_WineOnSale_Wine.com_WineChild_1920x1280.jpg,"['berry', 'cherry', 'chocolate']",red,2012
244,312,99715,France,The wine is fruity with just the right amount of tannic structure. It has spice and some firm toasty wood flavors in the background. Let the wine open up and drink from 2017.,,86,13,Bordeaux,Bordeaux,,Roger Voss,@vossroger,Château Laubes 2014  Bordeaux,Bordeaux-style Red Blend,Château Laubes,https://cdn.ct-static.com/labels/6a9c6bdb-68af-4a1e-9725-2b2a4eb2659d.jpg,"['fruit', 'spice']",red,2014
245,313,31865,Spain,"After this medium-bodied, fresh-styled Rioja opens with scratchy plum and berry aromas, hints of chocolate and light oak step in. The mouthfeel is wiry and fresh, with vibrant acidity creating high-toned, red-fruit flavors that finish with ringing zest.",,86,12,Northern Spain,Rioja,,Michael Schachner,@wineschach,Sierra Cantabria 2010  Rioja,Tempranillo,Sierra Cantabria,https://disndis.com/cdn/shop/files/Rioja_Sierra_Cantabria_Gran_Reserva_2010_1.jpg?v=1683284034,"['fruit', 'berry', 'chocolate', 'oak', 'plum']",red,2010
246,314,65968,US,"This clonal selection shows powerful aromas of cinnamon, mace, sandalwood and plump boysenberry on the attention-grabbing nose. There is a refreshing black-plum-skin tartness to the sip, which is decorated with potpourri, sagebrush, bay leaf and eucalyptus flavors. The mouthfeel is soft, yet zesty acidity and firm structure hold it all together.",Pommard 5,94,60,California,Santa Barbara County,Central Coast,Matt Kettmann,@mattkettmann,JCR 2014 Pommard 5 Pinot Noir,Pinot Noir,JCR,https://lookaside.fbsbx.com/lookaside/crawler/media/?media_id=10154916951633511,"['berry', 'plum']",red,2014
247,316,39490,Chile,"Warm, earthy and stewed smelling, but then sharp and tangy and acidic in the mouth. Red fruits are dominant, but there's a persistent scour to the wine that doesn't allow it to get to the next level of quality or ripeness.",Crucero Reserva,83,10,Colchagua Valley,,,Michael Schachner,@wineschach,Siegel 2007 Crucero Reserva Merlot,Merlot,Siegel,"https://www.wine.com/product/images/w_600,h_600,dpr_2.0,c_fit,q_auto:good,fl_progressive/155587_refDetail-0.jpg","['fruit', 'earth']",red,2007
248,317,121019,US,"Aromas of gunsmoke, tire rubber, ripe plum and garden herbs seem unsettled but still offer appeal. The palate is über-restrained in style, with the oak and alcohol pulled way back, putting the focus on its freshness and vibrancy. Give it a decant and put it on the dinner table to see it at its best.",Lonesome Springs Ranch,88,20,Washington,Yakima Valley,Columbia Valley,Sean P. Sullivan,@wawinereport,Wind Rose 2013 Lonesome Springs Ranch Malbec,Malbec,Wind Rose,http://storage.googleapis.com/cdn.vinoshipper.com/wine/135805/68ea1ecf-84cb-422f-b3a4-ed69b4e4806c.jpg,"['oak', 'herb', 'smoke', 'plum']",red,2013
249,318,109483,US,"The inviting scents of melting butter on hot dinner rolls and vanilla-lemon custard ensure a rich wine, and the palate delivers with caramelized apples, dominant oak and more vanilla on the finish. It is balanced out with mustardy tartness and lemon rind acidity.",Black Cap Reserve,89,48,California,Santa Barbara County,Central Coast,Matt Kettmann,@mattkettmann,Blackjack 2012 Black Cap Reserve Chardonnay,Chardonnay,Blackjack,https://cdn.ct-static.com/labels/4754fe39-576f-4f7e-967a-c7a1e41b502a.jpg,"['apple', 'lemon', 'vanilla', 'oak', 'butter', 'lemon']",white,2012
250,320,94353,US,"Right on the border of being a dessert wine, this unusual Pinot Gris has 2.8% residual sugar. It's betwixt and between—not really sweet enough for dessert, but too sweet for most other food. A simple sipping wine, perhaps?",,85,16,Washington,Columbia Valley (WA),Columbia Valley,Paul Gregutt,@paulgwine ,Goose Ridge 2011 Pinot Gris ),Pinot Gris,Goose Ridge,https://img.yumpu.com/24209096/1/500x640/wine-list-pdf-alderbrook-resort-amp-spa.jpg,[],white,2011
251,323,18838,Argentina,"As prices for Argentinean Malbecs climb, this is a really good value. It's earthy and full, and slightly rustic on the nose. Feels ripe and rugged, with scratchy tannins supporting red berry and oak-based vanilla notes. Feels fresh and good for a large-production Malbec.",,87,10,Mendoza Province,Mendoza,,Michael Schachner,@wineschach,Gouguenheim Winery 2009 Malbec,Malbec,Gouguenheim Winery,https://cdn.ct-static.com/labels/8c14dcc5-79b9-4596-b145-9ff69ac0d8ee.jpg,"['berry', 'vanilla', 'oak', 'earth']",red,2009
252,324,34194,US,Aromas of herb and red fruit lead to dried out but lightly gamy fruit flavors.,Estate Double River Vineyard,85,32,Washington,Walla Walla Valley (WA),Columbia Valley,Sean P. Sullivan,@wawinereport,Basel Cellars 2013 Estate Double River Vineyard Merlot ),Merlot,Basel Cellars,https://www.vintage38greendale.com/cdn/shop/products/basel_cellars_cabernet_sauvignon_800x.png?v=1541985798,"['fruit', 'herb']",red,2013
253,325,28095,France,"Now firmly in its new cellars, Clerc-Milon's wine is performing at the top of its form. This is a dense wine with juicy acidity as well as sweet tannins and ripe blackberry fruits. They give a ripe wine that is finely structured. The juicy aftertaste, typical of this vintage, is appealing although it does not detract from its power and longevity. Drink from 2022.",,94,62,Bordeaux,Pauillac,,Roger Voss,@vossroger,Château Clerc Milon 2012  Pauillac,Bordeaux-style Red Blend,Château Clerc Milon,http://static1.squarespace.com/static/55366cbae4b0819833f333b4/56ea83a0c2ea5121727c6f1e/56ebc0feb654f933795982f6/1539888782481/?format=1500w,"['fruit', 'berry']",red,2012
254,327,48346,US,"Equal parts Grenache and Mourvèdre, this appealing wine displays aromas of strawberry, orange rind and light peppery spices. It drinks dry with a lightly spritzy feel.",,89,18,Washington,Columbia Valley (WA),Columbia Valley,Sean P. Sullivan,@wawinereport,Lauren Ashton Cellars 2014 Rosé ),Rosé,Lauren Ashton Cellars,https://beginatbothell.com/wp-content/uploads/2019/03/lauren-ashton-cellars-wine-begin-at-bothell.jpg,"['berry', 'spice', 'pepper', 'orange']",rosé,2014
255,328,14196,Italy,"Rose petal, violet, tilled earth, leather and a whiff of pastry cream lead the nose. The ripe palate delivers succulent wild cherry accented with cracked black pepper and cinnamon supported by assertive tannins. It's delicious and structured but also forward, so enjoy now–2019.",Riserva,90,40,Piedmont,Barbaresco,,Kerin O’Keefe,@kerinokeefe,Bera 2009 Riserva,Nebbiolo,Bera,"https://www.wine-searcher.com/images/labels/54/13/10925413.jpg?width=260&height=260&fit=bounds&canvas=260,260","['cherry', 'pepper', 'earth', 'leather']",red,2009
256,329,34205,Chile,"Briary red-fruit aromas are earthy and mellow, with notes of red-apple skin and raspberry. This is medium in body, fresh and feels good on the palate. Plum, raspberry and vanilla flavors are lightly herbal, while the finish is largely smooth and mild.",Reserva,86,13,Maipo Valley,,,Michael Schachner,@wineschach,Santa Rita 2011 Reserva Cabernet Sauvignon,Cabernet Sauvignon,Santa Rita,https://winesipping.wordpress.com/wp-content/uploads/2016/02/20160225_155641.jpg?w=1108,"['fruit', 'berry', 'apple', 'vanilla', 'herb', 'earth', 'plum']",red,2011
257,330,89174,Italy,"Subdued aromas of menthol, dark spice and a whiff of leather lead the nose while the full-bodied palate offers mature black cherry, star anise and clove. Tightly wound tannins give a solid finish.",Monvigliero,92,76,Piedmont,Barolo,,Kerin O’Keefe,@kerinokeefe,Fratelli Alessandria 2012 Monvigliero,Nebbiolo,Fratelli Alessandria,http://leonandsonwine.com/cdn/shop/files/2017FratelliAlessandriaBaroloGramolere_BaroloDOCG_Italy.jpg?v=1685717550,"['cherry', 'spice', 'leather']",red,2012
258,331,87480,Spain,"Woodsy at first, then more foresty and stretched. The nose is peppery and light on fruit, while the palate shows tight cherry and raspberry flavors alongside edgy, invigorating tannins and acidity. A lively wine with bite and modest offsetting sweetness to the overriding snap.",Reserva,85,18,Northern Spain,Rioja,,Michael Schachner,@wineschach,Valserrano 2004 Reserva,Tempranillo Blend,Valserrano,https://www.ilovewine.eu/3663-large_default/valserrano-gran-reserva.jpg,"['fruit', 'berry', 'cherry', 'pepper']",red,2004
259,332,127139,US,"A blend of six different varieties with Syrah (61%) taking the lead, this pink-colored wine offers aromas of bubblegum, spice and herb. The off-dry cherry flavors seem a bit watery, winnowing toward the finish.",,86,14,Washington,Columbia Valley (WA),Columbia Valley,Sean P. Sullivan,@wawinereport,Three Rivers 2015 Rosé ),Rosé,Three Rivers,https://www.threeriverswinery.com/wp-content/uploads/sites/16/2023/04/TRW_2022-Rose_480x720.png?w=420,"['cherry', 'spice', 'herb']",rosé,2015
260,333,60459,Chile,"Gritty, tarry aromas of black olive and raspberry lead to a hard palate with choppy acidity. Sizzling plum and currant flavors come with a burnt note, while a long finish is bolstered by preserving acidity. This is a patented Chilean Cab: expect a heavy herbal character centered around olive and eucalyptus.",Gran Reserva,88,18,Maipo Valley,,,Michael Schachner,@wineschach,Morandé 2012 Gran Reserva Cabernet Sauvignon,Cabernet Sauvignon,Morandé,https://strictlywine.co.uk/5917/morande-gran-reserva-cabernet-sauvignon.jpg,"['berry', 'herb', 'plum']",red,2012
261,334,88431,US,"Dried red cherries, dark strawberry, mulberry, light baking spice and freshly cracked pepper show on the nose of this balanced bottling of 40% Mourvèdre, 28% Syrah, 22% Grenache and 10% Counoise. The sip starts with a dusty character, and then lovely flavors of light purple fruit, lavender powder and intriguing florality ensue. It drinks great now, but will age marvelously. Enjoy from 2018–2033.",Esprit de Tablas Estate Grown & Bottled Mourvèdre-Syrah--Grenache-Counoise,93,55,California,Paso Robles,Central Coast,Matt Kettmann,@mattkettmann,Tablas Creek 2013 Esprit de Tablas Estate Grown & Bottled Mourvèdre-Syrah--Grenache-Counoise Red,Rhône-style Red Blend,Tablas Creek,https://www.wineenthusiast.com/wp-content/assets/reviews/label-images/wine/wine/240772_42be_sept16_3690.jpg,"['fruit', 'berry', 'spice', 'pepper', 'floral']",red,2013
262,336,6110,Portugal,"This is a soft and fruity wine that is full of red berries and balanced acidity. It has some tannins, while wood aging has given extra richness. The finish is fresh, bright and juicy. Drink from 2016.",Conde de Vimioso Colheita Seleccionada,87,12,Tejo,,,Roger Voss,@vossroger,Falua 2013 Conde de Vimioso Colheita Seleccionada Red,Portuguese Red,Falua,https://www.portugalvineyards.com/105406-home_default/casa-de-cadaval-vinha-padre-pedro-red-2019.jpg,['fruit'],red,2013
263,338,110643,US,"Soft, plump and fruity, this pleasing, pure Washington Merlot pushes black cherry, coffee and baking chocolate flavors into a roundly accessible wine with no rough edges at all. It's a quaffer with cojones.",Conner Lee Vineyard,88,32,Washington,Columbia Valley (WA),Columbia Valley,Paul Gregutt,@paulgwine ,:Nota Bene 2007 Conner Lee Vineyard Merlot ),Merlot,:Nota Bene,https://notabenecellars.com/cdn/shop/products/NB07_ConnerLee-front_ab87e163-4773-414a-b00a-91bc437a1c93_large.jpg?v=1474135676,"['fruit', 'cherry', 'chocolate', 'coffee', 'plum']",red,2007
264,339,34589,US,"This wine is made from two exceptionally cool coastal sites: Platt, a single-vineyard in its own right; and Martinelli Charles Ranch Vineyard. The wine follows suit, allowing for a concentrated take on golden apple and stony minerality, the nose crisp and focused in salty, floral notes.",,90,40,California,Sonoma Coast,Sonoma,Virginie Boone,@vboone,Ramey 2014 Chardonnay,Chardonnay,Ramey,http://makerstable.com/wp-content/uploads/sites/2/2017/11/IMG_6582.jpg,"['apple', 'floral', 'mineral']",white,2014
265,340,886,France,"This Grenache-heavy blend (with 20% Syrah) offers a good amount of bittersweet cocoa powder and rich jammy black berries and all-fruit preserves on the nose and mouth. A hint of gaminess adds interest to the bouquet, while the crushed velvet texture and firm tannins transition into a long finish laced with earthy spice.",La Mère Grand,90,25,Languedoc-Roussillon,Minervois,,Lauren Buzzeo,@laurbuzz,Loup Blanc 2007 La Mère Grand Red,Rhône-style Red Blend,Loup Blanc,"https://www.wine-searcher.com/images/labels/50/18/10395018.jpg?width=260&height=260&fit=bounds&canvas=260,260","['fruit', 'spice', 'earth', 'cocoa']",red,2007
266,342,104831,Italy,"Tight aromas of berry, tar, smoke and roasted hazelnut open this wine. It's linear, silky and long on the finish, with a fine quality of tannin.",Mantico,90,45,Piedmont,Barbaresco,,,,Bersano 2008 Mantico,Nebbiolo,Bersano,https://images.vivino.com/thumbs/vvB7h0sHTdyibXgTj8gVYQ_pb_x600.png,"['berry', 'nut', 'smoke']",red,2008
267,344,80092,US,"This 50/50 blend of Pinot Blanc and Pinot Gris veers toward off dry, with open, juicy flavors of sweet lemon tea and apple pie. It's drinking well and should be consumed within two years of the vintage.",Chehalem Gold,87,21,Oregon,Willamette Valley,Willamette Valley,Paul Gregutt,@paulgwine ,Ardiri 2014 Chehalem Gold White,White Blend,Ardiri,https://images.vivino.com/labels/5lB73mZDQ7ebM_VQb6xIrQ.jpg,"['apple', 'lemon', 'lemon']",white,2014
268,346,25974,US,"Though more focused on Bordeaux varieties, the Daou brothers produce a fantastic Pinot Noir to chew on, with rich aromas of cherry pie set in a anise-flecked crust. The wine is soft and plush once sipped, with black cherries, root beer and strong black licorice elements.",,92,65,California,Edna Valley,Central Coast,Matt Kettmann,@mattkettmann,Daou 2012 Pinot Noir,Pinot Noir,Daou,"https://www.wine.com/product/images/w_600,h_600,dpr_2.0,c_fit,q_auto:good,fl_progressive/ielxuxlp7cuenzfncldy.jpg",['cherry'],red,2012
269,347,97730,France,"The wine comes from a tiny seven-acre estate to the east of the town of Saint-Emilion. Owned by the same family since 1847, it estate is making serious wine. This is a rich wine, perfumed by Cabernet Franc although firmly based in Merlot. Black plum and berries are strengthened by the firm tannins that will allow further aging. Drink from 2018.",,91,67,Bordeaux,Saint-Émilion,,Roger Voss,@vossroger,Château Rochebelle 2012  Saint-Émilion,Bordeaux-style Red Blend,Château Rochebelle,https://www.wine-selection.com/wp-content/uploads/2023/05/750ml-red-saint-emilion-grand-cru-classe-chateau-rochebelle-2012-2.png,['plum'],red,2012
270,349,66862,France,"Roses, raisins and even notes of banana mingle with the peachy richness. This aromatic headiness is cut beautifully by the focused freshness of the palate, reminiscent of freshly cut mandarins. This shows beautiful balance in aroma and body.",Vieilles Vignes,89,14,Alsace,Alsace,,Anne Krebiehl MW,@AnneInVino,Ruhlmann 2014 Vieilles Vignes Gewurztraminer,Gewürztraminer,Ruhlmann,https://images.vivino.com/thumbs/79DRUW2qTPW5UmeHwNLV9w_pb_x600.png,['peach'],white,2014
271,350,95073,US,"A very nice Cabernet at a great price for the quality. It's dry and smooth, with rich Napa tannins framing classic Cab flavors of blackberries, black currants, minerals and cedar. Tastes like it costs three times as much.",,90,15,California,Napa Valley,Napa,,,Leaping Lizard 2007 Cabernet Sauvignon,Cabernet Sauvignon,Leaping Lizard,https://www.wineenthusiast.com/wp-content/assets/reviews/label-images/wine/wine/108729_21B_2465_030110.jpg,['mineral'],red,2007
272,351,125676,US,"Cherry jam notes are bright on the nose, showing sawdust and menthol tones in the background. A smooth palate with little tannic grip is driven by juicy red currant, accented by a sprinkling of black pepper.",,86,25,Virginia,Virginia,,Alexander Peartree,,The Boneyard 2012 Cabernet Sauvignon,Cabernet Sauvignon,The Boneyard,https://www.virginiawine.org/rails/active_storage/blobs/redirect/eyJfcmFpbHMiOnsibWVzc2FnZSI6IkJBaHBBbFlmIiwiZXhwIjpudWxsLCJwdXIiOiJibG9iX2lkIn19--802700d39e0ee7d761dc5a88afe6737a762cd02c/2017.png,"['cherry', 'pepper']",red,2012
273,352,84974,Italy,"This shows a bold, overdone bouquet of Indian spice, bitter chocolate, crushed clove and black pepper. The tannins are firm and astringent, and the wine leaves a huge impression on the palate: it's almost too much of a good thing.",Opera Mia,88,28,Southern Italy,Taurasi,,,,Tenuta Cavalier Pepe 2006 Opera Mia,Aglianico,Tenuta Cavalier Pepe,https://cdn.ct-static.com/labels/dab9017d-3c0f-4b06-a724-53f106b3dbdf.jpg,"['chocolate', 'spice', 'pepper']",red,2006
274,353,62998,US,"Shows the brilliantly etched fruit and brisk acidity that mark an Edna Valley white wine. Tremendous in citrus and wintergreen flavors, its mouth-cleansing quality makes it ideal for an appetizer. Or try with Asian-style poultry and pork dishes.",,88,13,California,Edna Valley,Central Coast,,,Tangent 2010 Sauvignon Blanc,Sauvignon Blanc,Tangent,https://mshanken.imgix.net/wso/bolt/wine-detail/details/white_still.png,"['fruit', 'citrus']",white,2010
275,354,13391,US,"A wondrous array of blackberry, pepper, dried meat, soft lavender, well-integrated lilac and crushed graphite show on the nose of this bottling from a vineyard planted in 2008. A firm but not overpowering tannic structure and bright acidity present flavors of dried violets, blueberry and tar on the palate.",Chapel G,92,48,California,Santa Ynez Valley,Central Coast,Matt Kettmann,@mattkettmann,Zaca Mesa 2013 Chapel G Syrah,Syrah,Zaca Mesa,https://cdn.ct-static.com/labels/e89c220a-7e7d-428c-a76b-f1343bfcbb82.jpg,"['berry', 'pepper']",red,2013
276,355,18411,US,"This is a young, meaty Pinot, a bottle of substantial red cherry, earthy mushroom and soil that's bright and layered with a heartiness to the texture and finish. The back label mentions that the grapes were sourced from Bacigalupi Vineyards, a longstanding star in the Russian River Valley.",Lucie,88,60,California,Russian River Valley,Sonoma,Virginie Boone,@vboone,Bacio Divino 2012 Lucie Pinot Noir,Pinot Noir,Bacio Divino,https://cdn11.bigcommerce.com/s-qtoc3aerdw/images/stencil/2048x2048/products/453/1875/15_thumb__91809.1474356547.jpg?c=2,"['cherry', 'earth']",red,2012
277,356,78836,France,"Perfumed and fruity, this shows touches of wood aging, although these are really just hints that lift the fruit. Acidity and a crisp, tangy texture are more important to this wine that bursts with concentrated citrus and green-plum flavors, finishing with so much freshness. Drink from 2017.",Vau de Vey Premier Cru,93,21,Burgundy,Chablis,,Roger Voss,@vossroger,Romain Bouchard 2013 Vau de Vey Premier Cru,Chardonnay,Romain Bouchard,https://cdn.ct-static.com/labels/dd1eb25f-7e30-43bb-9bde-40867e8bbf2c.jpg,"['fruit', 'citrus', 'plum']",white,2013
278,357,99860,US,"Fresh, appley and floral with a touch of tangy yogurt cream, this is an approachable yet elegant Virginia pick. Delicate apple and pear flavors shine through on this full-bodied wine with fresh acidity, supple texture and balanced alcohol.",Reserve,86,27,Virginia,Virginia,,Anna Lee C. Iijima,,Barrel Oak 2008 Reserve Chardonnay,Chardonnay,Barrel Oak,https://blogger.googleusercontent.com/img/b/R29vZ2xl/AVvXsEhfpq2PQwxrJUwMSMWjUSBqNopHes3zL4QOLiz-wbFsz8JcIQJ68P76UEn_-FYRokFIk-jlVvlIxqlLfg_Jb7aWzKuAwrEHAY7eLeXm6qRcQkvY4URAS00dunlov6GRedC8f8umarCu2E8J/s1600/early+mtn+Kilauwen+Stone+mtn+22+Jun+043.JPG,"['apple', 'pear', 'floral']",white,2008
279,358,125170,US,"A little too hot and brawny in tannins, which provides a cut across the palate that interferes with pleasure. If you can get past that, the wine is nicely dry and rich in fruit, with cherry, tobacco, spice and oak flavors.",Estate Grown,86,35,California,Dry Creek Valley,Sonoma,,,Mounts 2007 Estate Grown Cabernet Franc,Cabernet Franc,Mounts,https://cdn.ct-static.com/labels/7c172e19-a5eb-4377-b601-73e9db9ccc2d.jpg,"['fruit', 'cherry', 'oak', 'spice']",red,2007
