,Unnamed: 0.1,Unnamed: 0,country,description,designation,points,price,province,region_1,region_2,taster_name,taster_twitter_handle,title,variety,winery,img_url,extracted_flavors,wine_type,year
466,586,27983,US,"The caramel oakiness of this wine is offset by austere structure and a focused midpalate, the flavors leaning toward cool-climate green apple and kumquat. It returns to richness and intensity on the finish.",Low Vineyard,86,34,California,Oak Knoll District,Napa,Virginie Boone,@vboone,Piña 2014 Low Vineyard Chardonnay,Chardonnay,Piña,https://www.wineenthusiast.com/wp-content/assets/reviews/label-images/wine/wine/277497_91be_jun18.jpg,"['apple', 'oak']",white,2014
467,587,22392,US,"This is a good but pretty ordinary Chardonnay despite its famous Rochioli brand name. It's creamy and forward in apricot and orange jam, pineapple custard and sweet oak flavors, with good acidity.",Estate Grown,87,50,California,Russian River Valley,Sonoma,,,Rochioli 2012 Estate Grown Chardonnay,Chardonnay,Rochioli,https://www.rochioliwinery.com/assets/images/contentblock/photos/Rochioli_Estate_Wine_Beauty_5.jpg,"['apple', 'oak', 'orange']",white,2012
468,588,111544,US,"A solid Chardonnay, this is dry, rich and creamy, with lemon, lime and tropical fruit flavors. A touch of oak brings a nice note of buttered toast.",,86,13,California,North Coast,North Coast,,,Fleur 2010 Chardonnay,Chardonnay,Fleur,https://www.carneroswinecompany.com/cdn/shop/files/Shopify_Product_Imagee.png?v=1724363736&width=320,"['fruit', 'tropical', 'lemon', 'lime', 'oak', 'butter', 'lemon']",white,2010
469,589,22764,Portugal,"In the classic Portuguese tradition, this is a blend of four of the Alentejo's local grapes. Together they give big power and dark tannins. They also offer great black fruits, fresh acidity and a firm, very dry core. The wine needs to soften over the next several years, so drink from 2017.",Reserva,90,18,Alentejo,,,Roger Voss,@vossroger,Adega Cooperativa de Borba 2011 Reserva Red,Portuguese Red,Adega Cooperativa de Borba,https://images.vivino.com/thumbs/BVPmKqmTR6yX57A8lA1bSA_pb_x600.png,['fruit'],red,2011
470,590,93266,US,"This Cabernet Franc leans toward the green side, revealing aromas of cassis, green beans and leafy herbs. It feels elegant in composition, with soft red-fruit flavors and silky tannins. A mushroom note peaks on the short to medium finish.",,85,22,Virginia,Virginia,,,,Naked Mountain 2009 Cabernet Franc,Cabernet Franc,Naked Mountain,https://www.virginiawine.org/rails/active_storage/blobs/redirect/eyJfcmFpbHMiOnsibWVzc2FnZSI6IkJBaHBBbHNmIiwiZXhwIjpudWxsLCJwdXIiOiJibG9iX2lkIn19--6dea41f5f15992a30206e9e867529885901bce62/2012.png,"['fruit', 'herb']",red,2009
471,591,65427,Chile,"A composed bouquet of field notes, nettle, tangerine and passion fruit is almost like Sauvignon Blanc. The palate feels lifted and tangy, while flavors of lime, pie cherry and plum skins set up a long, pure, driving finish with cleansing acidity and lasting citrus flavors.",,86,14,Colchagua Valley,,,Michael Schachner,@wineschach,Calcu 2012 Rosé,Rosé,Calcu,https://i0.wp.com/cheapwineratings.com/images/calcu.rose.2012.jpg,"['fruit', 'citrus', 'cherry', 'lime', 'plum']",rosé,2012
472,592,53553,Italy,"Scents of Rennet apple and white wild flower float out of the glass. Bright and creamy, the palate doles out white peach, Bartlett pear and nectarine alongside vibrant acidity and a silky mousse. It closes crisp and clean.",Brut Millesimato,89,20,Veneto,Valdobbiadene Prosecco Superiore,,Kerin O’Keefe,@kerinokeefe,Villa Sandi 2016 Brut Millesimato,Glera,Villa Sandi,https://images.vivino.com/thumbs/9minuG54Qzq3qFdrBnPFnw_pb_x600.png,"['apple', 'pear', 'peach']",sparkling,2016
473,593,68969,US,"Certainly one of the best wines made in the Hudson River region, this richly composed Cabernet Franc juxtaposes zesty cranberry and pomegranate against a velvety, supple palate full of summery black plums and cherries. Touches of savory olive and green pepper lend complexity and nuance. The finish is long, framed by persistent yet fine-grained tannins. Drinks well now but should hold well till 2020.",Proprietor's Special Reserve,91,35,New York,Hudson River Region,New York Other,Anna Lee C. Iijima,,Millbrook 2013 Proprietor's Special Reserve Cabernet Franc,Cabernet Franc,Millbrook,https://rockinredblog.com/wp-content/uploads/2014/08/millbrook.jpg,"['berry', 'pepper', 'plum']",red,2013
474,594,88833,Portugal,"Touriga Nacional and Tinta Roriz are blended together in this rich yet structured and fruity wine. It has fresh acidity and a hint of the ocean in its crisp red-currant fruits. The structure is softening and filling out, so drink from 2016.",Vale da Mata Reserva,88,37,Lisboa,,,Roger Voss,@vossroger,Herdade do Rocim 2011 Vale da Mata Reserva Red,Portuguese Red,Herdade do Rocim,https://images.vivino.com/thumbs/NcdzbWpRTnigerXhTIT77g_pb_x600.png,['fruit'],red,2011
475,596,48642,US,"The wine is two-thirds Grenache, 30% Syrah and the rest Mourvèdre. It's warm and fruity, lightly spicy and finishing with tannins showing green tea and leaf. This is mostly Elerding fruit from the Horse Heaven Hills vineyard; balanced and firm.",Sinister Hand Red Wine,90,24,Washington,Columbia Valley (WA),Columbia Valley,Paul Gregutt,@paulgwine ,Owen Roe 2006 Sinister Hand Red Wine Red ),Red Blend,Owen Roe,"https://www.wine-searcher.com/images/labels/16/28/11611628.jpg?width=260&height=260&fit=bounds&canvas=260,260",['fruit'],red,2006
476,597,124435,France,"The wood element is important here, but it is based on a firm Cabernet Sauvignon structure, dry but rich tannins. The wine is a great success for the vintage, giving sweetness, ripe fruit that only shows light extraction, and dark plum and berry flavors. The feeling is of polished fruit and wood, rounded but always dense.",,95,450,Bordeaux,Pauillac,,Roger Voss,@vossroger,Château Mouton Rothschild 2007  Pauillac,Bordeaux-style Red Blend,Château Mouton Rothschild,https://images.vivino.com/thumbs/wTc-AQhFRQaPiviCvRt5ww_pl_480x640.png,"['fruit', 'berry', 'plum']",red,2007
477,598,6062,US,"This wine is all from Underwood Mountain and shows perfumed aromas of grape skins, pear and apricot. It drinks medium sweet with abundant stone-fruit flavors.",Reminiscence,89,18,Washington,Columbia Gorge (WA),Washington Other,Sean P. Sullivan,@wawinereport,Ancestry 2013 Reminiscence Riesling ),Riesling,Ancestry,https://s3-media0.fl.yelpcdn.com/bphoto/_Qm6mP695fHgf3WwKsihzQ/348s.jpg,"['fruit', 'pear']",white,2013
478,602,8776,US,"This was pressed whole-cluster and fermented in French oak, roughly one-third new. It's a flavorful wine with caramel apple appeal, good definition and medium length. The barrels put a pleasing toasty frame around the finish.",Lumière,89,30,Washington,Columbia Valley (WA),Columbia Valley,Paul Gregutt,@paulgwine ,Sparkman 2012 Lumière Chardonnay ),Chardonnay,Sparkman,https://spectrumwine.blob.core.windows.net/wine-test/fd3a11b4-77ff-46d6-a5ba-052616517955.jpg,"['apple', 'oak']",white,2012
479,603,117271,Italy,"Aromas suggesting red berry and scorched soil lead the nose while the straightforward palate offers wild cherry, blackberry and a hint of clove. Lithe tannins provide the framework. Drink soon.",Redimore,87,25,Southern Italy,Irpinia,,Kerin O’Keefe,@kerinokeefe,Mastroberardino 2015 Redimore Aglianico,Aglianico,Mastroberardino,https://www.htfwines.co.uk/cdn/shop/products/MastroberardinoRedimoreIrpiniaAglianicoIGT2015.png?v=1647608710,"['berry', 'cherry']",red,2015
480,604,9937,Austria,"A very taut, tight wine, crisp, green, perfumed. It has delicious white currants and hedgerow fruits, its delicacy and elegance balanced by its intensity of flavor. There is a definite herbal, mineral aftertaste. Screwcap.",Zöbing,90,25,Kamptal,,,Roger Voss,@vossroger,Hirsch 2007 Zöbing Riesling,Riesling,Hirsch,https://cdn.ct-static.com/labels/61dfd3a6-fe5f-422e-acc6-e9f4476dfb18.jpg,"['fruit', 'herb', 'mineral']",white,2007
481,605,46602,Australia,"This full-bodied, creamy-textured Shiraz from the Lyndoch subregion of the Barossa starts off with vanilla, raspberries and a dusting of confectioner's sugar, but turns darker and more savory with air, adding dark berry and hickory notes. The long finish is richly textured, yet simultaneously marked by crisp acids.",Miamba,92,28,South Australia,Barossa,,Joe Czerwinski,@JoeCz,Grant Burge 2009 Miamba Shiraz,Shiraz,Grant Burge,https://cdn.ct-static.com/labels/6ac5a85c-f157-47b5-bbd7-fc4ed998bf4b.jpg,"['berry', 'vanilla']",red,2009
482,606,85560,US,"A tart, short, sharp entry leads into raspberry and strawberry flavors, underscored with a light earthiness. The youthful fruit and bright acidity suggests it will show improvement with further bottle age, as the tannins smooth out.",Bon Vin Rouge,87,23,Washington,Yakima Valley,Columbia Valley,Paul Gregutt,@paulgwine ,Bateaux Cellars 2011 Bon Vin Rouge Syrah,Syrah,Bateaux Cellars,https://savornw.com/images/articles/CathedralRidge2019CabSauv.jpg,"['fruit', 'berry', 'earth']",red,2011
483,607,34180,Chile,"This spunky rosé relies mostly on Itata Cinsault, but also Colchagua fruit. The nose is alert but simple, with tangerine and peach-pit aromas. This feels round yet lively, while briny stone-fruit and citrus flavors finish salty and a bit sulfuric.",Le Rosé,85,21,Chile,,,Michael Schachner,@wineschach,Lapostolle 2016 Le Rosé Rosé,Rosé,Lapostolle,https://images.vivino.com/thumbs/xIy30YgTQueT-rG0umXgsw_pb_x600.png,"['fruit', 'citrus', 'peach']",rosé,2016
484,608,106852,France,"This legendary Madiran is, its fruit tannins just softened by wood aging. It's smoky, brooding, very concentrated, and worth aging for 10 years.",Château Montus,94,35,Southwest France,Madiran,,Roger Voss,@vossroger,Alain Brumont 2007 Château Montus Tannat-Cabernet Franc,Tannat-Cabernet Franc,Alain Brumont,https://cdn.ct-static.com/labels/7534eac3-44db-49a5-9d1c-9b36e5236dbd.jpg,['fruit'],red,2007
485,609,8581,Portugal,"The minerality that seems to come from this quinta makes for a wine that needs time, and this wine is defiantly young. However, its chocolate flavors, bitter toast and dense structure all promise well.",Quinta do Coa,89,26,Douro,,,Roger Voss,@vossroger,CARM 2006 Quinta do Coa Red,Portuguese Red,CARM,https://d2uqzpf6d2kb73.cloudfront.net/eyJidWNrZXQiOiJzcGluZS1wcm9kdWN0LWltYWdlcy1wcm9kIiwia2V5IjoiM2FlMDhhYTYtOTQ3NS00N2Q0LWE0NjYtMGNiZjgwMTk0OThhLnBuZyIsImVkaXRzIjp7InJlc2l6ZSI6eyJoZWlnaHQiOjgwMH0sInRyaW0iOjAuMX19,"['chocolate', 'mineral']",red,2006
486,610,71199,Austria,"A blend of Zweigelt, Merlot, Cabernet Sauvignon, hints of white pepper and bay leaf frame the just-ripe, crunchy damson-plum aroma. Tight, finely-knit tight tannins make for a lasting structure that can mature, while the acidity keeps this classy and fresh. The dark, brooding plum flavor plays in the background and culminates in a spicy, peppery finish.",Mephisto,90,40,Vienna,,,Anne Krebiehl MW,@AnneInVino,Weingut Christ 2011 Mephisto Red,Red Blend,Weingut Christ,https://wine-world.at/wp-content/uploads/2021/10/rainerchrist_mephisto_2018_vorne.webp,"['pepper', 'plum']",red,2011
487,611,80333,US,"A big, ripe, voluptuous Zinfandel, packed with flavor. The deliciousness factor of blackberries, cherries, anise and dark chocolate comes at the cost of high alcohol, which limits the wine's elegance but makes it super-drinkable with the richest barbecue imaginable.",Trenton Station Lion Ridge,91,26,California,Russian River Valley,Sonoma,,,Joseph Swan Vineyards 2006 Trenton Station Lion Ridge Zinfandel,Zinfandel,Joseph Swan Vineyards,https://cdn.ct-static.com/labels/387c2019-223a-41cf-b668-30f52cad9dc6.jpg,['chocolate'],red,2006
488,612,64584,US,"It's dry to slightly off-dry, with clean, zesty acidity and decent flavors of citrus fruits, green apples, Asian pears and peaches.",,86,28,California,Central Coast,Central Coast,,,Ty Caton 2009 Riesling,Riesling,Ty Caton,https://static.wineaccess.com/optimized/images/products/2023/12/Ty_Caton_Moon_Mountain_District/6d4e0a273c2868a53a274416602228ca.png,"['fruit', 'citrus', 'apple', 'pear', 'peach']",white,2009
489,614,5488,France,"Full and rounded, this is a soft wine, more suited to food than as an aperitif. The apple and red currant fruits are textured and spiced with lemon zest and mandarin orange flavors, finishing with some richness.",Vie Vité,86,18,Provence,Côtes de Provence,,Roger Voss,@vossroger,Domaine Sainte-Marie 2012 Vie Vité Rosé,Rosé,Domaine Sainte-Marie,https://cdn.ct-static.com/labels/1f3187f0-f461-4a1f-b5e2-37708d42ffe4.jpg,"['fruit', 'apple', 'lemon', 'spice', 'lemon', 'orange']",rosé,2012
490,615,37286,US,"From a three-acre block of the Valley View Vineyard just east of Solvang, this clonal selection shows cedar, black olive, black pepper and elderberry fruit on the tightly wound nose. Tart but ripe boysenberry fruit shows on the palate, spiced with peppercorn, more cedar and a slate-like minerality. Sticky tannins carry those flavors into the finish.",Estate Vineyards Clone 6,91,78,California,Santa Ynez Valley,Central Coast,Matt Kettmann,@mattkettmann,Lucas & Lewellen 2013 Estate Vineyards Clone 6 Cabernet Sauvignon,Cabernet Sauvignon,Lucas & Lewellen,x-raw-image:///a047d3b7f5b7cb6fdc4efc52a22ce47987ed600513fc19786c9b432def9c6121,"['fruit', 'berry', 'spice', 'pepper', 'mineral']",red,2013
491,616,121381,US,"Spicy-sweet notes of dried orange peel and mango waft from this aromatic late-harvest wine. Lip-smacking marmalade sweetness is countered by a piercing strike of lemon acidity. Juicy and quaffable, it would be a lovely accompaniment to spicy Asian cuisine or a cheese plate.",Late Harvest,87,34,New York,Hudson River Region,New York Other,Anna Lee C. Iijima,,Millbrook 2014 Late Harvest Riesling,Riesling,Millbrook,https://images.vivino.com/labels/bx9S8M1PQQqh9D3BjQzDng.jpg,"['lemon', 'lemon', 'orange']",white,2014
492,617,94402,New Zealand,"This medium-bodied wine features classic apple-and-citrus Chardonnay aromas and flavors, just tinged with floral notes and a touch of spice. It's fresh and clean, good as a predinner drink or with simply grilled fish or chicken.",Left Field,85,20,Hawke's Bay,,,Joe Czerwinski,@JoeCz,Te Awa 2009 Left Field Chardonnay,Chardonnay,Te Awa,https://www.wine-searcher.com/images/labels/06/75/11630675.jpg,"['citrus', 'apple', 'spice', 'floral']",white,2009
493,620,98620,US,"This is an unusual blend of principally Syrah, Malbec, Tempranillo and Souzao, along with bits of Petit Verdot, Merlot, and Cabernet Sauvignon. Aromas of cocoa, vanilla and green herb lead to tart cherry flavors that seem underripe. The finish comes up short.",Estate Grown Ora Proprietary,86,30,Washington,Wahluke Slope,Columbia Valley,Sean P. Sullivan,@wawinereport,Desert Wind 2015 Estate Grown Ora Proprietary Red,Red Blend,Desert Wind,"https://www.wine-searcher.com/images/labels/58/71/11305871.jpg?width=260&height=260&fit=bounds&canvas=260,260","['cherry', 'vanilla', 'herb', 'cocoa']",red,2015
494,621,108767,Italy,The nose is extremely shy but eventually reveals a hint of dark-skinned fruit and toast. The hefty one-dimensional palate offers raw red berry and oak-driven spice but not much fruit richness.,Riserva,85,90,Piedmont,Barolo,,Kerin O’Keefe,@kerinokeefe,Bersano 2010 Riserva,Nebbiolo,Bersano,https://cdn.zochil.shop/d672e0dd-e1d2-4fe0-b254-ab3877398c6c.jpg,"['fruit', 'berry', 'oak', 'spice']",red,2010
495,622,61364,US,"Shows the problems that California Grenache so frequently runs into, with a mushroomy, vegetal streak running right through the cherry and oak flavors. The wine is not an ager.",,82,28,California,Happy Canyon of Santa Barbara,Central Coast,,,Plan B 2010 Grenache,Grenache,Plan B,https://visitventuraca.com/wp-content/uploads/2020/07/8bf4d5fb66dae2e3597db2b067952945.jpg,"['cherry', 'oak']",red,2010
496,623,66932,US,"Cabernet Sauvignon makes up just under three-quarters of this wine with the balance Syrah. A blend of fruit from River Rock and Jack's vineyards, it's aromatically reserved, with notes of flowers, green herb, cherry and moist earth. The tart fruit flavors are silky and full in feel, bringing a lovely sense of presence to the mixture of fruit and savory flavors. The finish lingers.",The Creator,94,55,Washington,Walla Walla Valley (WA),Columbia Valley,Sean P. Sullivan,@wawinereport,K Vintners 2013 The Creator Red ),Red Blend,K Vintners,https://images.vivino.com/thumbs/5pAUmPXvQ5iCvsDSN9vbKA_pb_x600.png,"['fruit', 'cherry', 'herb', 'earth']",red,2013
497,624,13462,US,"An amazing wine for less than $30, this bottling by veteran Winemaker Dan Lee starts with tightly wound aromas of dried yogurt, Meyer lemon peel, honeysuckle and Asian-pear flesh. Great grapefruit-pith flavors kick off the sip, where lime juice and baking soda combine for a tight, bright, grippy, laser-focused and high-toned palate.",Highland,93,28,California,Santa Lucia Highlands,Central Coast,Matt Kettmann,@mattkettmann,Morgan 2014 Highland Chardonnay,Chardonnay,Morgan,https://d1h1synnevvfsx.cloudfront.net/pub/media/catalog/product/cache/ebc6733575d5c8d1cd0f057bf2f42791/_/M/_MG_8311.jpg,"['fruit', 'pear', 'lemon', 'lime', 'honey', 'lemon']",white,2014
498,625,47472,US,"In this price range, this is one of the classiest Chardonnays currently on the market. Brightened with fine acidity, it's flavors of pineapple, buttered toast and cream are delicious.",,91,17,California,Santa Ynez Valley,Central Coast,,,Firestone 2010 Chardonnay,Chardonnay,Firestone,https://www.wineenthusiast.com/wp-content/assets/reviews/label-images/wine/wine/172539_07BE_AUG13_3270.jpg,"['apple', 'butter']",white,2010
499,627,73146,US,"Rich in cherry and raspberry pie filling flavors, with red currant, cola and exotic pomegranate notes and a super-spicy finish. Bone dry, this Pinot shows the classy elegance of its vineyard source. On the downside is very tart acidity, as if the wine contained a big squirt of lime juice. Hard to tell where it's going, if anywhere, but nice after decanting with a grilled steak.",Sanford & Benedict,91,54,California,Sta. Rita Hills,Central Coast,,,Roessler 2008 Sanford & Benedict Pinot Noir,Pinot Noir,Roessler,https://cdn.ct-static.com/labels/416a3399-a0fe-4177-be2d-86114c382c2f.jpg,"['berry', 'cherry', 'lime']",red,2008
500,628,97298,US,"Notes of fresh honeysuckle, baking soda and shaved citron mix with tons of slate, gravel and wet rocks on the nose of this great bottling. There's the slightest touch of sweetness to the palate, where waves of vibrant acidity carry forth flavors of orange blossom and mandarin as well as a grapefruit peel twist. It's certainly drinkable now, but will mature and evolve well through 2034.",Riven Rock Vineyard,92,30,California,San Luis Obispo County,Central Coast,Matt Kettmann,@mattkettmann,Cutruzzola 2014 Riven Rock Vineyard Riesling,Riesling,Cutruzzola,https://www.wineenthusiast.com/wp-content/assets/reviews/label-images/wine/wine/244968_66be_oct16_3700.jpg,"['fruit', 'honey', 'orange']",white,2014
501,631,121562,Germany,"Delicately perfumed with notes of lemon, tart stone fruit and white florals, this off-dry Riesling builds in intensity and ripeness on the palate. It's lushly textured, with flavors of fleshy peach and apricot that are brightened by lemon-lime acidity.",Piesporter Goldtröpfchen Kabinett GL,90,31,Mosel,,,Anna Lee C. Iijima,,Reichsgraf von Kesselstatt 2012 Piesporter Goldtröpfchen Kabinett GL Riesling,Riesling,Reichsgraf von Kesselstatt,https://mshanken.imgix.net/wso/bolt/MagazineArticles/2018/073118/germalpha_073118_1600.jpg,"['fruit', 'peach', 'lemon', 'lime', 'floral', 'lemon']",white,2012
502,633,102664,US,"Rustic, dark and deeply tannic, this wine is sourced from the Oak Knoll District of the Napa Valley, known for relatively cooler-climate varieties, though not necessarily Pinot Noir. It dances in dark plum and leather, finishing short.",Rodgers Vineyard,84,35,California,Napa Valley,Napa,Virginie Boone,@vboone,Cenay 2011 Rodgers Vineyard Pinot Noir,Pinot Noir,Cenay,"https://www.wine-searcher.com/images/labels/28/15/10432815.jpg?width=260&height=260&fit=bounds&canvas=260,260","['oak', 'leather', 'plum']",red,2011
503,634,44096,US,"Cola-like in flavor, with earthier notes of tobacco and leather. Drinks pretty lean, and the tannins are strong. Finshes with a bitterness of acids and tannins.",,84,20,California,Central Coast,Central Coast,,,Savannah-Chanelle 2001 Pinot Noir,Pinot Noir,Savannah-Chanelle,https://cdn.ct-static.com/labels/1898b46a-b8d3-4010-8b80-bf3f9e62a54a.jpg,"['earth', 'leather']",red,2001
504,635,5864,US,"From coastal hills near Jenner, this is true Sonoma Coast fruit, and it shows in its cool-climate embrace of red fruit and white pepper. Leather saddle marks the personality of the texture and soft acidity keeps it full-bodied and relatively dense.",Coryelle Fields Vineyard,88,27,California,Sonoma Coast,Sonoma,Virginie Boone,@vboone,Tin Barn 2013 Coryelle Fields Vineyard Syrah,Syrah,Tin Barn,x-raw-image:///c689cfbf06d9e66d2307b2d52ad568d4dea16c108e0d4cf7db90cc3bfbd9c581,"['fruit', 'pepper', 'leather']",red,2013
505,636,61036,US,"Fans of fruity Pinot Noirs will love this one, with its sweet raspberry and cherry jam flavors. Beyond that, there's not much going on. It's silky in texture, with a boost of acidity.",,84,20,California,Napa Valley,Napa,,,Ramspeck 2010 Pinot Noir,Pinot Noir,Ramspeck,http://villagewinemerchant.com/cdn/shop/products/ramspeckpinotnoir_1200x1200.jpg?v=1682383899,"['fruit', 'berry', 'cherry']",red,2010
506,637,28043,US,"This 75-case production of Pinot Noir explodes with flavors of cherries, cola, pomegranates, persimmons, exotic spices and toasty oak. Fine acidity reins all the flavor in, leading to a dry, refined finish. The wine is sourced from grapes in the southern Santa Lucia Mountains. Drink now–2028.",Barrel Select,90,58,California,San Luis Obispo County,Central Coast,,,Asuncion Ridge 2010 Barrel Select Pinot Noir,Pinot Noir,Asuncion Ridge,https://www.princeofpinot.com/media/images/11_07/11_07-1.jpg,"['oak', 'spice']",red,2010
507,638,50433,Italy,"Apple, citrus and yellow floral aromas are what hits the nose first. Them they carry over to the simple, zesty palate along with green pear and a note of bitter nut. Bracing acidity generates a clean finish.",,86,13,Northeastern Italy,Collio,,Kerin O’Keefe,@kerinokeefe,Ca'Ronesca 2014 Pinot Grigio,Pinot Grigio,Ca'Ronesca,"https://assets.wine.com/winecom/image/upload/w_600,h_600,dpr_2.0,c_fit,q_auto:good,fl_progressive/187313_refDetail-0.jpg","['citrus', 'apple', 'pear', 'nut', 'floral']",white,2014
508,640,50392,US,"Somewhere between off-dry and sweet, this Riesling features orange, tropical fruit and honey flavors, with a refreshing cut of acidity. It saw no oak.",,86,13,California,Santa Ynez Valley,Central Coast,,,Gainey 2010 Riesling,Riesling,Gainey,https://cdn11.bigcommerce.com/s-hw4h0s3mr6/images/stencil/1280x1280/products/251253/18452/j483tz7lwbntywxptsvq__94258.1687979993.jpg?c=1,"['fruit', 'tropical', 'oak', 'honey', 'orange']",white,2010
509,641,120050,France,"Black fruits dominate this rich wine. While it has tannins, they are soft and dusty, already well integrated into the fruitiness and generous texture. It's full in the mouth, delicious and ripe. Drink from 2015.",Tradition,89,15,Southwest France,Cahors,,Roger Voss,@vossroger,Domaine de Cause 2011 Tradition Malbec,Malbec,Domaine de Cause,https://images.vivino.com/thumbs/Uk39seJsQ3-zWJiOpJNtkg_pb_x600.png,['fruit'],red,2011
510,642,107380,Argentina,"Leafy tomato, dried cherry and baked plum aromas cover most ends of the Pinot spectrum. This feels round, ripe and a touch tannic, while oaky flavors of vanilla and chocolate dominate, ending with more than a dash of wood spice.",Primogénito,88,22,Other,Patagonia,,Michael Schachner,@wineschach,Bodega Patritti 2012 Primogénito Pinot Noir,Pinot Noir,Bodega Patritti,"https://www.wine-searcher.com/images/labels/45/93/10694593.jpg?width=260&height=260&fit=bounds&canvas=260,260","['cherry', 'chocolate', 'vanilla', 'oak', 'spice', 'plum']",red,2012
511,643,10299,US,"High on the deliciousness-factor, this shows soft, seemingly sweet flavors of raspberry, cinnamon, smoky butter, sugar cookie and vanilla. It's a little one-dimensional, but that dimension is a nice one. Drink now.",,88,25,California,Dry Creek Valley,Sonoma,,,Artezin 2010 Zinfandel,Zinfandel,Artezin,"https://assets.wine.com/winecom/image/upload/w_600,h_600,dpr_2.0,c_fit,q_auto:good,fl_progressive/120104.jpg","['berry', 'vanilla', 'butter']",red,2010
512,644,105237,Germany,"Whiffs of sweet pastry and sun-kissed nectarines lend richness to this zesty, off-dry Riesling. Sweet and tart, it's lip smackingly juicy, finishing on a deliciously astringent lemon pith note. Drink now through 2017.",Haus Klosterberg Feinherb,90,20,Mosel,,,Anna Lee C. Iijima,,Markus Molitor 2012 Haus Klosterberg Feinherb Riesling,Riesling,Markus Molitor,https://sw-5a7a.kxcdn.com/media/20/5d/ba/1660513030/2012442-markus-molitor-riesling-haus-klosterberg-feinherb_6421.jpg,"['lemon', 'lemon']",white,2012
513,645,111660,Italy,"This opens with aromas of blue flower, ripe woodland berry and a whiff of pressed powder. The robust palate doles out juicy black cherry, mature plum, licorice and savory herb alongside firm, velvety tannins. It's concentrated and already accessible but will offer drinking pleasure for the next several years. Drink through 2021.",Asinone,92,60,Tuscany,Vino Nobile di Montepulciano,,Kerin O’Keefe,@kerinokeefe,Poliziano 2011 Asinone,Red Blend,Poliziano,https://cdn.ct-static.com/labels/68f51808-06d9-4809-b442-a7b63afbb27e.jpg,"['berry', 'cherry', 'herb', 'plum']",red,2011
